{
  "formatVersion": 1,
  "name": "😀😀😀😀😀😀😀😀😀😀😀😀😀😀😀😀😀😀😀😀😀😀😀😀😀😀😀😀😀😀😀😀😀😀😀😀😀😀😀😀😀😀😀😀😀😀😀😀😀😀😀😀😀😀😀😀😀😀😀😀😀😀😀😀😀😀😀😀😀😀😀😀😀😀😀😀😀😀😀😀😀😀😀😀😀😀😀😀😀😀😀😀😀😀😀😀😀😀😀😀",
  "seed": "13",
  "sources": [
    {
      "type": "library",
      "id": "11111111111111111111111111111111"
    }
  ],
  "timing": {
    "broadcastDay": {
      "utcOffsetMinutes": 0
    }
  }
}
